marca,nome,preco_velho_reais,preco_velho_centavos,preco_novo_reais,preco_novo_centavos,nota_avaliacao,num_avaliacoes
OLYMPIKUS,Tênis Olympikus Neblina Masculino,279,90,31,10,4.6,(48)
OLYMPIKUS,Tênis Olympikus Cyber 4 Caminhada Corrida Running Confort,259,99,228,79,,
OLYMPIKUS,Tênis Olympikus Challenger 5 - Masculino - Laranja,268,70,239,14,,
MIZUNO,Tenis Mizuno Cool Ride Preto ,245,62,30,,5.0,(9)
ASCENSION,Tenis Masculino E Feminino De Caminhada Academia Ortopedic ,69,90,6,79,,
JOHNCAT,Tenis Masculino Yezee Leve Corrida Lançamento Super Promoção,78,90,26,30,,
OLYMPIKUS,Tênis Masculino Olympikus  Marte Oferta!,199,90,189,90,4.6,(19)
,Tênis Meia Masculino E Feminino Sem Cadarço Confortável,81,90,7,96,4.8,(113)
TAYGRA,Taygra Cinza Tenis  Original Envio 24h,179,90,17,49,5.0,(5)
OLYMPIKUS,Tênis Olympikus Estilo 2 Preto,209,90,34,98,4.7,(17)
DM DAMANDO,Tenis Masculino Esportivo Academia Confortavel Crossfit Leve,82,90,8,06,5.0,(5)
KAPPA,Tênis Kappa Impact Masculino Open Box,99,90,9,71,4.8,(20)
,Tênis Esportivo Masculino Meia Academia Treino Confortável,79,90,7,77,4.5,(20)
RAINHA,Tênis Esportivo Rainha Fire Eva.soft Fixfit Conforto Ra0267,178,19,35,64,,
,Tênis Meia  Super Confortável Macio + Brinde Carteira ,74,98,7,29,,
POLO JOY,Tênis Bota Café Cano Médio Polo Joy Jeans Envio Imediato,124,90,12,14,4.5,(2)
BOX200,"Tênis Masculino Corrida,caminhada Esportivo Box 200 Original",69,20,6,73,,
PHILIPP PLEIN,Tênis Masculino Philipp Plein Dream Big 78%-nitrogen  ,299,99,33,33,4.1,(9)
,Kit 2 Tênis Masculino Prospect Ultra Varias Cores Leve Macio,139,90,34,98,,
,Tenis Redley Originals Preto Unissex - 3294,219,10,197,16,4.8,(567)
POLO JOY,Tenis Masculino Sapatenis Polo Joy Confortavel Casual Cinza,139,99,118,99,,
,Tênis Preto Feminino Dowens F1 Esportivo Confortável,78,92,69,44,,
OLYMPIKUS,Tenis Masculino Olympikus Beats Supporter Evasense  Original,279,60,27,11,,
ON RUNNING,On Running The Roger Advantage Masculino White Midnight ,949,01,92,,5.0,(1)
ZEUS,Tênis Zeus Velcro Infantil Esportivo Caminhada Corrida 59kx,64,99,21,66,,
OLYMPIKUS,Tênis Olympikus Cyber 4 Marinho E Laranja - Unissex,259,99,209,96,,
CARDUME,Tênis Cardume Porus Pesca Lazer Camping Disponível 3 Cores,76,89,7,47,4.6,(5)
NEW BALANCE,Tênis New Balance 55 Masculino Promoção Pix,329,07,273,47,,
OLYMPIKUS,Tênis Olympikus Cyber 4 Marinho E Laranja - Unissex,259,99,210,59,,
LETS,Tenis Masculino Corrida Casual Caminhada Confortavel Lets,119,90,11,65,4.4,(591)
ASCENSION,Tênis Esportivo Ortopédico Para Academia Treino Dia A Dia,139,10,13,52,4.5,(420)
ASCENSION,Tenis Masculino Feminino Basic Crossfit Caminhada Esporte ,69,,23,,,
K2,Tenis Academia Alta Performance Leve Confortavel K2-2010,78,90,74,95,5.0,(2)
,Tênis Esportivo Masculino Leve Confortável Academia Corrida,79,90,26,63,4.8,(6)
NEW BALANCE,Tênis New Balance Masculino 880v14,1.187,90,855,28,,
FITTY,Tênis Masculino Caminhada Corrida Casual Academia Barato,118,70,11,54,4.8,(9)
FILA,Tênis Masculino Fila Racer Nairobi Preto Corrida Original,379,99,251,36,4.8,(4)
OLYMPIKUS,Tenis Para Homem Olympikus Estilo Academia Corrida,199,34,19,,,
UNDER ARMOUR,Tênis De Corrida Under Armour Charged Starlight,199,99,33,33,4.6,(18)
OLYMPIKUS,Olympikus Caminhada Cygnus Masculino Adultos,189,90,31,65,4.8,(959)
FILA,Fila Float Maxxi 2 Pro Masculino Adultos,810,,81,,5.0,(5)
FILA,Fila KR6 Masculino Adultos,420,31,328,83,4.7,(343)
ADIDAS,adidas Response Masculino Adultos,499,99,303,72,4.7,(114)
OLYMPIKUS,Olympikus Treino Dynamic Masculino Adultos,199,99,19,44,4.8,(7688)
LYND,Tênis Lynd Academia Corrida Treino Gravit Flux 2,229,90,22,35,4.9,(13)
NEW BALANCE,New Balance 373v2 Masculino Adultos,312,25,30,,4.5,(96)
ADAPTION,Kit 2 Pares De Tenis Masculino Academia Limited + Relogio,130,10,12,65,4.4,(4206)
OLYMPIKUS,Tenis Masculino Olympikus Delta 122 Esportivo,150,58,14,,,
WEST,Kit 2 Tenis Masculino Cores Promoção Confortavel Treino Wave,161,40,32,28,4.0,(34)
MIZUNO,Tênis Mizuno Masculino 12s Leve E Confortável!,339,97,166,58,4.3,(177)
FILA,Fila Racer Spider Masculino Adultos,311,92,230,82,4.8,(211)
SCHIARELI,Tênis Confortavel Esportivo Leve Macio Varias Cores,139,90,34,98,4.6,(72)
PLAZA,Tênis Masculino Plaza Neo Academia Caminhada Promoção Casual,62,90,6,11,4.3,(12)
POLO JOY,Combo 2 Pares Tenis Masculino Polo Joy Casual Slip On Iate,169,90,16,51,4.6,(392)
OLYMP,Tênis Kit 2 Pares  Olymp Lançamento Zoo Meg Top Homem Sport#,143,75,35,,4.3,(449)
,Tênis Polo Energy Masculino,78,97,26,32,4.5,(31)
,Tenis Olympikus Dynamic Masculino Esportivo  Original,259,99,246,99,4.8,(106)
FILA,Tenis Fila Masculino Promoção ,289,90,32,21,4.6,(61)
PERFLEX,Tênis Esportivo Academia Caminhada Corrida,59,90,49,11,4.5,(17)
SCHIARELI,Tenis  Esportivo Leve Confortavel Corrida Academia Original,120,50,108,,,
MIZUNO,Mizuno Victory RSP Masculino Adultos,429,99,347,70,5.0,(9)
EVOLTENN,Kit 3 Tênis Desportivo Solado Trançado Macio Envio Imadiato,189,90,174,70,4.4,(108)
OLYMPIKUS,Olympikus Corre Trilha Sem gênero Adultos,599,90,443,92,5.0,(8)
PLAZA,Kit 4 Pares Tênis Masculino Casual Academia Caminhada Atacad,289,90,32,21,4.3,(440)
OLYMPIKUS,Tênis Olympikus Metro,209,90,34,98,5.0,(6)
,Tênis Chuky Linha Eco Nylon Espumado Ranclafe,159,90,31,98,4.9,(18)
PLAZA,Kit 2 Pares De Tênis Masculino Academia Caminhada Casual Neo,139,90,13,60,4.2,(600)
,Tênis Meia Masculino E Feminino Sem Cadarço Confortável,62,90,6,11,4.7,(219)
ADRUN,Tênis Esportivo Masculino Adrun Power Fly 10104m Marinho,189,90,31,65,,
SKECHERS,Tenis Skechers Go Run Fast 894258-bkw Preto,296,77,32,97,,
,Tenis Hibrido Sapatilha Aquatica Neoprene Confortável Top,54,,18,,4.7,(48)
MIZUNO,Tênis Mizuno Enigma Masculino,359,99,335,99,,
EVOLTENN,Kit 3 Combo Tenis Masculino Corrida Treino Academia Leve,189,95,180,45,4.6,(337)
MIZUNO,Tenis Mizuno Victory Rsp Preto,364,58,36,46,5.0,(9)
,Tênis Yezy 350 Masculino- Promoção,299,90,33,32,4.6,(11)
,Kit Tênis 2 Pares Masculino Super Confortável Leve Academia,129,90,12,63,4.4,(51)
MIZUNO,Mizuno Wave Falcon 5 Masculino Adultos,429,90,299,88,4.9,(39)
HEADER,Kit 1 Tênis Masculino Caminhada Spider Levinho + 1 Chinelo,108,80,36,27,4.2,(5)
,Tenis Box 200 Bx2325 Masculino Lançamento Liquidação,49,33,16,,5.0,(2)
PUMA,Puma Viz-Tech Viz Runner V2 BDP Masculino Adultos,366,56,317,07,4.6,(134)
,Kit 3 Pares Tênis Lançamento Mega Leve Olymp Masculino Macio,204,90,34,15,4.6,(122)
,Tênis Chuky Linha Eco Nylon Espumado Ranclafe Preto/branco,159,90,31,98,5.0,(5)
OLDSEN,Tênis Unissex Caminhada Barato Corrida Oldsen Jaguar 34-43,69,90,6,79,4.6,(113)
STARFLEX,Tênis Com Amortecedor Masculino Corrida Academia Flex Molas,133,55,33,39,4.6,(64)
,Tênis Masculino Prospect Ultra Leve Macio Esportivo Academia,78,90,26,30,,
MIZUNO,Tênis Mizuno Wave Vitality 4 Masculino,379,90,37,99,,
PAM KIDS,Tenis Para Crianças Masculino Tênis Atacado Menino Infantil,35,90,11,97,4.7,(11)
OLYMPIKUS,Oferta Olympikus Cyber 3 Preto/ Dourado C/nf Lucaisane Tênis,229,99,22,36,4.9,(37)
OLYMPIKUS,Olympikus Eros Sem gênero Adultos,199,05,189,38,4.8,(175)
POLO JOY,Tenis Confortável Academia Esporte Polo Joy,78,02,7,58,4.5,(99)
MIZUNO,Mizuno Wave Endeavor Masculino Adultos,473,30,47,,4.7,(160)
,Tenis Sapatilha Neoprene Bike Pesca Unissex Top Promoção ,52,33,17,,4.6,(534)
,Tenis Sapatilha Neoprene Bike Pesca Unissex Top Promoção ,52,33,17,,4.6,(534)
OLYMPIKUS,Tênis Olympikus Diffuse 4 Preto E Dourado,200,85,33,48,4.7,(73)
UNDER ARMOUR,Tênis Under Armour Spawn 3 Preto,349,90,34,99,4.7,(297)
OLDSEN,Kit 2 Tênis Masculino Casual Oldsen Jaguar Frete Gratis Novo,159,90,15,54,4.4,(318)
FACEOFF,Tênis Masculino Esporte Fino Kit Carteira + Relogio Brinde,104,90,10,20,4.4,(136)
,Tenis Esportivo Masculino Corrida Caminhada Lançamento Ghost,120,90,11,75,,
NEW BALANCE,New Balance Fresh Foam Arishi V4 Masculino Adultos,499,99,424,99,4.5,(4)
ULTRABONE,Tênis Unissex Academia Leve Macio Basico Caminhada Fitness ,63,99,60,79,4.3,(7)
,Mizuno Wave Prophecy X Masculino Adultos,78,,,,,
ON,Tênis On Running Cloudgo Corrida Masculino,699,90,69,,,
OLYMPIKUS,Olympikus Challenger 4 Masculino Adultos,258,39,25,05,4.8,(10)
ZEUZ,Tênis Esportio Masculino Caminhada Academia Confortável Leve,64,90,6,31,,
POLO BLU,Sapatenis Masculino Kit Tenis Relogio Com Meia Polo,94,90,9,22,4.7,(14)
GALAXY,Tênis Masculino Caminhada Academia Leve Promoção Kit 3 Pares,176,90,17,19,4.4,(153)
,Kit Tênis Masculino 2 Pares Super Confortável Leve Academia ,129,90,12,63,4.3,(9)
OLYMPIKUS,Tênis Masculino E Feminino Reverso 2 Olympikus,379,99,279,99,4.7,(559)
,3 Pares Tênis Esportivo Tenis Masculino Leve E Macio Frete,169,90,33,98,4.3,(101)
,Conjunto Moletom Masculino Pijama Blusa Tenis Masculino,159,90,15,54,4.3,(32)
,Tênis Masculino Academia Caminhada Fxb Lançamento Corrida,69,90,23,30,4.4,(557)
NEW BALANCE,New Balance Fresh Foam X 1080 V12 Masculino Adultos,999,90,739,92,5.0,(5)
OLYMPIKUS,Olympikus Ultraleve 130g Feminino Adultos,208,22,20,,4.8,(4172)
VIA LIVRE,Tênis Masculino Ultra Leve Advanced Pro Run Academia Vl060,134,90,13,11,3.7,(3)
MIZUNO,Tênis Mizuno Masculino Beta Lançamento!,369,98,177,59,4.3,(187)
MIZUNO,Mizuno Wave Falcon 4 Masculino Adultos,381,66,240,44,4.8,(189)
FILA,Fila Classic Runner Masculino Adultos,259,90,32,49,4.7,(450)
WM,Tenis Revelation Masculino Feminino Promoção Pronta Entrega,109,99,10,69,4.5,(148)
BAD FISH,Tênis Adventure Caminhada Academia Trail Trekking Air Mesh,199,49,19,39,4.7,(168)
REEBOK,Tênis Reebok Nfx Trainer Masculino,499,90,354,92,4.8,(20)
,Kit Combo 2 Tenis Masculino P/ Treino Academia Confortável,166,80,33,36,4.4,(26)
,Kit 2 Pares De Tenis Esportivo Feminino Masculino,159,45,15,,4.6,(22)
OLYMPIKUS,Tênis Masculino Olympikus Proof 3 ,167,23,16,,4.0,(3)
,Kit Bermuda Masculina Moletom + Tenis Esporte Com Brinde,109,90,10,68,4.3,(35)
,Sapatenis Masculino Casual Sapato Tênis Original Lançamento,76,40,7,43,4.2,(53)
OLYMPIKUS,Tênis Masculino Olympikus Corrida Macio Wellness Original,229,99,218,49,4.9,(13)
,Kits 3 Pares Tenis Masculino Corrida Caminhada Barato Casual,148,40,37,10,,
DM DAMANDO,Kit 4 Pares Tênis Masculino Confortável Academia Crossfit ,239,90,225,50,4.5,(13)
,Tenis Masculino Kit Olimp 02 Pares Academia Entrega Rapida,144,90,14,08,4.4,(770)
SAPATOFRAN,Kit Tênis Academia Sapatênis Chinela Relógio Carteira,129,80,116,82,4.3,(275)
OLDSEN,Tênis Lançamento Original Confortável Corrida Esportivo,63,90,6,21,5.0,(7)
NEW STYLE,Kit 2 Tenis Masculino Sport De Caminhar Confortavel +brindes,109,90,10,68,,
WEST,Tênis Kit 2 Pares Mizwest 20 Promoção Masculino Garantia !!1,160,70,15,62,4.1,(394)
POLO BLU,Sapato Masculino Tenis Sapatenis Promoçao Kit Relogio Meia,69,90,6,79,4.6,(22)
LORENZZO LOPEZ,Tenis Para Caminhada Corrida Tênis Barato Fique Em Casa,59,90,19,97,3.9,(42)
DM DAMANDO,Tênis Masculino Academia Treino Crossfit Sola Transada Macia,72,90,7,09,,
,Lançamento Tênis Chunky Snekeaer Couro Cano Medio ,189,90,31,65,4.8,(6)
,Tenis Hibrido Top Sapatilha Pra Agua Confortavel Oferta Top ,53,67,17,,4.5,(75)
EVOLTENN,Kit 3 Tênis Feminino Unissex Masculino De Corrida Academia,189,90,167,11,4.7,(49)
BURCOLLI,Tênis Sapatilha Masculina E Feminina Trilha Aquática Pesca,59,90,56,90,4.7,(511)
OLYMPIKUS,Olympikus Treino Dynamic Masculino Adultos,199,99,19,44,4.8,(7688)
FILA,Fila KR6 Masculino Adultos,420,31,328,83,4.7,(343)
ADIDAS,adidas Response Masculino Adultos,499,99,303,72,4.7,(114)
ZEUZ,Tênis Masculino Leve Esportivo Conforto Dia A Dia Elástico,89,99,30,,4.4,(10)
OLDSEN,Kit 2 Tenis Masculino Unissex Botinha Casual Academia Urbano,159,90,15,54,4.0,(6)
DK SHOES,Tenis Masculino Dk Skatista Original Street Casual Skate,48,90,16,30,4.9,(29)
DM DAMANDO,Tênis Masculino Esporte/passeio Ultraleve Conforto + Relógio,78,90,74,95,4.2,(182)
,Tênis Masculino Corrida Esportivo Caminhada Academia Oferta.,113,90,37,97,4.4,(8)
EVOLTENN,Tênis Boost Masculino Evoltenn Esporte Casual Colmeia Treino,68,50,6,66,4.8,(4)
OLDSEN,Tenis Masculino Oldsen Spyder Kit 2 Macio Conforto Promoção,149,90,14,57,4.0,(2)
DM DAMANDO,Tenis Masculino Para Sport Treino Academia Ultra Leve ,84,90,28,30,4.7,(40)
,Tênis Masculino Esportivo Academia Corrida Confortável,54,90,5,34,,
POLO BLU,Tênis Masculino Botinha Polo Blu Kit Carteira E Relogio !,99,90,9,71,4.4,(73)
,Kit 2 Tênis Masculino Respiral Conforto Para Seus Pés Brinde,105,53,10,26,5.0,(1)
,Tênis Masculino Esportivo Meia Academia Treino Confortável,89,90,29,97,,
EVOLTENN,Kit 2 Tênis Masculino Academia Crossfit Corrida Barato ,159,90,125,99,4.5,(751)
FREE JUMP,Sapato Masculino Tênis Esportivo Ortopédico Esporão E Facete,129,90,67,54,4.5,(58)
OVERTRAK,Tênis Esportivo Lançamento Original Confortável,89,90,66,52,4.5,(97)
OLDSEN,Kit 2 Tenis Masculino Academia Botinha Casual Conforto Moda,159,90,15,54,4.0,(20)
ADAPTION,Kit 2 Pares Tenis + Relogio Brinde Academia Caminhada Leve,129,90,12,63,4.5,(91)
,Tênis Esportivo Masculino Vorax Ultra Leve Para Caminhada,118,33,39,,,
DM DAMANDO,Combo 2 Tênis Crossfit Masculino Caminhada Academia +relógio,149,90,37,48,4.9,(10)
HEADER,Kit 2 Tênis Casual Masculino Spider Top Promoção + Relógio,128,60,12,50,4.4,(18)
OLYMPIKUS,Tênis Olympikus Challenger 5 Preto Unissex Pro,285,50,256,87,5.0,(7)
OLYMPIKUS,Tênis Olympikus Eros Branco Unissex Pro,190,62,171,,4.7,(18)
,Kit 2 Tênis Academia Caminhada Unisex Oadsey Easy Top,139,90,112,10,4.3,(142)
HEADER,Kit 2 Tênis Masculino Spider Caminhada Promoção + Relógio,128,60,12,50,4.6,(17)
OLYMPIKUS,Olympikus Treino Volcan Masculino Adultos,157,41,15,30,4.7,(1293)
,Tênis Para Corrida Olimpikus Veloz Caminhada Crossfit,99,90,94,90,4.3,(111)
OLYMPIKUS,Tênis Olympikus Challenger 4 Unissex,199,99,33,33,4.7,(6)
UNDER ARMOUR,Tênis Masculino Ch. Wing Se  Under Armour Novo,329,99,244,99,4.6,(69)
OLP,Tênis Asisc Reveletion Masculino Feminino Do 34-43 Promoção,92,15,8,96,,
,Tênis Bolha Plus 1 Tn Corrida Muito Leve Promoção Envio Ja,118,86,39,62,,
,Tênis Refletivo 12 Molas Masculino & Feminino Amortecimento ,101,90,33,97,4.5,(89)
OLYMPIKUS,Tênis Olympikus Diffuse 4 Unissex,169,99,34,,4.7,(49)
,Sapatilha Hibrida Nautica Pesca Esportiva Corrida Pedal,43,50,14,50,4.7,(75)
,Tenis Sapatilha Unissex Esporte Bike Trilha Pesca Camping ,132,90,33,22,4.0,(2)
OLYMPIKUS,Olympikus Wellness 2 Masculino Adultos,194,33,32,,4.6,(56)
SKECHERS,Tênis Skechers Ultra Flex 2.0  Masculino - Cinza,349,90,34,99,,
UNDER ARMOUR,Under Armour Buzzer Masculino Adultos,389,90,337,25,4.5,(911)
OLYMPIKUS,Tênis Olympikus Poseidon Unissex,149,99,37,50,4.7,(12)
VANS,Vans UltraRange V3 Sem gênero Adultos,399,86,139,95,3.4,(10)
OLP,Tênis Reveletion Masculino Feminino Do 34 Ao 43 Promoção,89,99,30,,5.0,(1)
,Tênis Okley Na Promoção Bravo 2.0 Resistente Confortável,109,90,36,63,4.5,(95)
,Sapatilha Híbrida Água Ciclismo Pesca Trilha ,132,90,33,22,4.6,(29)
OLYMPIKUS,Olympikus Cyber 3 Masculino Adultos,197,99,19,24,4.7,(43)
OLYMPIKUS,Olympikus CORRIDA Swift 4 Feminino Adultos,279,99,31,11,4.8,(1115)
,Tênis Masculino Tn 01 Plus Lançamento Envio Ja Oferta,118,86,39,62,,
OLYMPIKUS,Olympikus CORRIDA Voa 2 Masculino Adultos,261,62,32,,4.8,(509)
MIZUNO,Mizuno Space 3 Masculino Adultos,299,98,33,33,4.7,(1674)
MIZUNO,Tênis De Corrida Masculino Mizuno Wave Interceptor Rsp,329,99,33,,4.2,(6)
